{
  "version": 2,
  "layer": 2,
  "width": 160,
  "height": 120,
  "header_font_size": 14.0,
  "key_font_size": 10.0,
  "encoder_font_size": 9.0,
  "keys": [
    {
      "x": 20,
      "y": 50,
      "width": 60,
      "height": 50,
      "label": ["E2E"],
      "held": true,
      "transparent": false,
      "momentary_layer": 2
    },
    {
      "x": 90,
      "y": 50,
      "width": 50,
      "height": 50,
      "label": ["ENTER"],
      "held": false,
      "transparent": true,
      "momentary_layer": null
    }
  ],
  "encoders": []
}
